{
  "schema_version": "1.0",
  "id": "img_99_pert_3.1",
  "steps": [
    {
      "step_id": "s1",
      "kind": "initial",
      "latex": "\\text{L.H.S.} = \\frac{\\sin 5x - 2\\sin 3x + \\sin x}{\\cos 5x - \\cos x} = \\frac{\\sin 5x + \\sin x - 2\\sin 3x}{\\cos 5x - \\cos x}",
      "derives_from": []
    },
    {
      "step_id": "s2",
      "kind": "step",
      "latex": "= \\frac{2\\sin 3x \\cos 2x - 2\\sin 3x}{-2\\sin 3x \\sin 2x}",
      "derives_from": [
        "s1"
      ]
    },
    {
      "step_id": "s3",
      "kind": "answer",
      "latex": "= \\frac{1 - \\cos 2x}{\\sin 2x} = \\frac{2\\sin^2 x}{2\\sin x \\sin x} = \\tan x = \\text{R.H.S.}",
      "derives_from": [
        "s2"
      ]
    }
  ],
  "pipeline": {
    "approach": "llm_ocr_plus_math_core",
    "stages": [
      {
        "name": "transcribe",
        "backend": "ground-truth",
        "status": "ok"
      },
      {
        "name": "verify",
        "backend": "sympy@1.14.0",
        "status": "ok",
        "duration_ms": 0
      }
    ]
  },
  "verdict": "indeterminate",
  "is_correct": null,
  "first_error_step": null,
  "last_correct_step": null,
  "findings": [],
  "steps_reviewed": [
    {
      "step_id": "s1",
      "verdict": "indeterminate",
      "note": "TIMEOUT_OR_WORKER_EXIT"
    },
    {
      "step_id": "s2",
      "verdict": "indeterminate",
      "note": "TIMEOUT_OR_WORKER_EXIT"
    },
    {
      "step_id": "s3",
      "verdict": "indeterminate",
      "note": "TIMEOUT_OR_WORKER_EXIT"
    }
  ],
  "meta": {
    "run_id": "cas-a6b3fb59-3f20-4ab7-874b-4b47ef9929bb",
    "approach": "llm_ocr_plus_math_core",
    "stage": "verify",
    "model": "sympy@1.14.0",
    "duration_ms": 0,
    "created_at": "2026-10-08T18:15:50.161113Z",
    "tool_versions": {
      "sympy": "1.14.0"
    }
  }
}
