{
  "schema_version": "1.0",
  "id": "img_221_pert_5.3",
  "steps": [
    {
      "step_id": "s1",
      "kind": "answer",
      "latex": "\\left\\{ \\left( \\frac{1}{3} \\right)^{-2} - \\left( \\frac{1}{2} \\right)^{-3} \\right\\} \\div \\left( \\frac{1}{4} \\right)^{-2} = \\left\\{ \\frac{1^{-2}}{3^{-2}} - \\frac{1^{-3}}{2^{-3}} \\right\\} \\div \\frac{1^{-2}}{4^{-2}} = \\frac{3^{2} - 2^{3}}{1^{2}} \\div 4^{2} = \\frac{9 - 8}{16} = \\frac{1}{16}",
      "derives_from": []
    },
    {
      "step_id": "s2",
      "kind": "note",
      "latex": "\\text{Note that } 3^2 = 9 \\text{ and } 2^3 = 8. \\text{ Also, } 4^2 = 16.",
      "derives_from": []
    },
    {
      "step_id": "s3",
      "kind": "answer",
      "latex": "\\left( \\frac{5}{8} \\right)^{-7} \\times \\left( \\frac{8}{5} \\right)^{-5} = \\frac{5^{-7}}{8^{-7}} \\times \\frac{8^{-5}}{5^{-5}} = \\frac{5^{-7} \\times 8^{-5}}{8^{-7} \\times 5^{-5}} = 5^{-2} \\times 8^{2} = \\frac{8^{2}}{5^{2}} = \\frac{64}{25}",
      "derives_from": []
    },
    {
      "step_id": "s4",
      "kind": "note",
      "latex": "\\text{Here, } 8^2 = 64 \\text{ and } 5^2 = 25.",
      "derives_from": []
    }
  ],
  "pipeline": {
    "approach": "llm_ocr_plus_math_core",
    "stages": [
      {
        "name": "transcribe",
        "backend": "ground-truth",
        "status": "ok"
      },
      {
        "name": "verify",
        "backend": "sympy@1.14.0",
        "status": "ok",
        "duration_ms": 0
      }
    ]
  },
  "verdict": "indeterminate",
  "is_correct": null,
  "first_error_step": null,
  "last_correct_step": null,
  "findings": [],
  "steps_reviewed": [
    {
      "step_id": "s1",
      "verdict": "correct",
      "note": "Exact expression identity with preserved domain"
    },
    {
      "step_id": "s2",
      "verdict": "indeterminate",
      "note": "Text/units/conditions are outside the symbolic grammar: Note that; Text/units/conditions are outside the symbolic grammar: Also,; Exact expression identity with preserved domain; Unsupported input at character 1"
    },
    {
      "step_id": "s3",
      "verdict": "correct",
      "note": "Exact expression identity with preserved domain"
    },
    {
      "step_id": "s4",
      "verdict": "indeterminate",
      "note": "Text/units/conditions are outside the symbolic grammar: Here,; Exact expression identity with preserved domain"
    }
  ],
  "meta": {
    "run_id": "cas-6a8a8854-25b8-4ebf-9d06-2d07e72cae9b",
    "approach": "llm_ocr_plus_math_core",
    "stage": "verify",
    "model": "sympy@1.14.0",
    "duration_ms": 0,
    "created_at": "2026-10-08T18:15:31.801939Z",
    "tool_versions": {
      "sympy": "1.14.0"
    }
  }
}
