{
  "schema_version": "1.0",
  "id": "img_136_pert_2.2",
  "steps": [
    {
      "step_id": "s1",
      "kind": "initial",
      "latex": "10x^2 - 18x^3 + 14x^4 = 10x^2 + (-18x^3) + 14x^4",
      "derives_from": []
    },
    {
      "step_id": "s2",
      "kind": "step",
      "latex": "10x^2 + (-18x^3) + 14x^4 = 0",
      "derives_from": [
        "s1"
      ]
    },
    {
      "step_id": "s3",
      "kind": "step",
      "latex": "5x^2 - 9x^3 + 7x^4 = 0",
      "derives_from": [
        "s2"
      ]
    },
    {
      "step_id": "s4",
      "kind": "step",
      "latex": "x^2(5 - 9x + 7x^2) = 0",
      "derives_from": [
        "s3"
      ]
    },
    {
      "step_id": "s5",
      "kind": "step",
      "latex": "x^2 = 0 \\implies x = 0",
      "derives_from": [
        "s4"
      ]
    },
    {
      "step_id": "s6",
      "kind": "step",
      "latex": "5 - 9x + 7x^2 = 0",
      "derives_from": [
        "s4"
      ]
    },
    {
      "step_id": "s7",
      "kind": "step",
      "latex": "a = 7, \\ b = -9, \\ c = 5",
      "derives_from": [
        "s6"
      ]
    },
    {
      "step_id": "s8",
      "kind": "step",
      "latex": "x = \\frac{-b \\pm \\sqrt{b^2 - 4ac}}{2a}",
      "derives_from": [
        "s7"
      ]
    },
    {
      "step_id": "s9",
      "kind": "step",
      "latex": "x = \\frac{9 \\pm \\sqrt{81 - 140}}{14}",
      "derives_from": [
        "s8"
      ]
    },
    {
      "step_id": "s10",
      "kind": "step",
      "latex": "x = \\frac{9 \\pm \\sqrt{-59}}{14}",
      "derives_from": [
        "s9"
      ]
    },
    {
      "step_id": "s11",
      "kind": "answer",
      "latex": "x = \\frac{9 \\pm i\\sqrt{59}}{14}",
      "derives_from": [
        "s10"
      ]
    }
  ],
  "pipeline": {
    "approach": "llm_ocr_plus_math_core",
    "stages": [
      {
        "name": "transcribe",
        "backend": "ground-truth",
        "status": "ok"
      },
      {
        "name": "verify",
        "backend": "sympy@1.14.0",
        "status": "ok",
        "duration_ms": 0
      }
    ]
  },
  "verdict": "indeterminate",
  "is_correct": null,
  "first_error_step": null,
  "last_correct_step": null,
  "findings": [],
  "steps_reviewed": [
    {
      "step_id": "s1",
      "verdict": "correct",
      "note": "Exact expression identity with preserved domain"
    },
    {
      "step_id": "s2",
      "verdict": "indeterminate",
      "note": "Symbolic equation is a premise; checked against previous equation when applicable; Identity to substituted value needs an explicit substitution"
    },
    {
      "step_id": "s3",
      "verdict": "correct",
      "note": "Symbolic equation is a premise; checked against previous equation when applicable; Exact real solution-set comparison"
    },
    {
      "step_id": "s4",
      "verdict": "correct",
      "note": "Symbolic equation is a premise; checked against previous equation when applicable; Exact real solution-set comparison"
    },
    {
      "step_id": "s5",
      "verdict": "indeterminate",
      "note": "Symbolic equation is a premise; checked against previous equation when applicable; Separate equation/substitution requires task context"
    },
    {
      "step_id": "s6",
      "verdict": "indeterminate",
      "note": "Symbolic equation is a premise; checked against previous equation when applicable; Separate equation/substitution requires task context"
    },
    {
      "step_id": "s7",
      "verdict": "correct",
      "note": "Symbolic equation is a premise; checked against previous equation when applicable"
    },
    {
      "step_id": "s8",
      "verdict": "indeterminate",
      "note": "Unsupported token '\\\\pm'"
    },
    {
      "step_id": "s9",
      "verdict": "indeterminate",
      "note": "Unsupported token '\\\\pm'"
    },
    {
      "step_id": "s10",
      "verdict": "indeterminate",
      "note": "Unsupported token '\\\\pm'"
    },
    {
      "step_id": "s11",
      "verdict": "indeterminate",
      "note": "Unsupported token '\\\\pm'"
    }
  ],
  "meta": {
    "run_id": "cas-b3bd230a-5cc6-4d70-8ff8-23eb34562fef",
    "approach": "llm_ocr_plus_math_core",
    "stage": "verify",
    "model": "sympy@1.14.0",
    "duration_ms": 0,
    "created_at": "2026-10-08T18:15:33.377336Z",
    "tool_versions": {
      "sympy": "1.14.0"
    }
  }
}
