{
  "schema_version": "1.0",
  "id": "img_151_pert_5.3",
  "steps": [
    {
      "step_id": "s1",
      "kind": "initial",
      "latex": "8\\sqrt{15} \\div 2\\sqrt{3} = \\frac{8\\sqrt{3} \\times \\sqrt{5}}{2\\sqrt{3}}",
      "derives_from": []
    },
    {
      "step_id": "s2",
      "kind": "step",
      "latex": "= \\frac{8 \\times \\sqrt{3} \\times \\sqrt{5}}{2 \\times \\sqrt{3}}",
      "derives_from": [
        "s1"
      ]
    },
    {
      "step_id": "s3",
      "kind": "step",
      "latex": "= \\frac{8 \\times \\sqrt{15}}{2 \\times \\sqrt{3}}",
      "derives_from": [
        "s2"
      ]
    },
    {
      "step_id": "s4",
      "kind": "answer",
      "latex": "= 4\\sqrt{5}",
      "derives_from": [
        "s3"
      ]
    }
  ],
  "pipeline": {
    "approach": "llm_ocr_plus_math_core",
    "stages": [
      {
        "name": "transcribe",
        "backend": "ground-truth",
        "status": "ok"
      },
      {
        "name": "verify",
        "backend": "sympy@1.14.0",
        "status": "ok",
        "duration_ms": 0
      }
    ]
  },
  "verdict": "correct",
  "is_correct": true,
  "first_error_step": null,
  "last_correct_step": null,
  "findings": [],
  "steps_reviewed": [
    {
      "step_id": "s1",
      "verdict": "correct",
      "note": "Exact expression identity with preserved domain"
    },
    {
      "step_id": "s2",
      "verdict": "correct",
      "note": "Exact expression identity with preserved domain"
    },
    {
      "step_id": "s3",
      "verdict": "correct",
      "note": "Exact expression identity with preserved domain"
    },
    {
      "step_id": "s4",
      "verdict": "correct",
      "note": "Exact expression identity with preserved domain"
    }
  ],
  "meta": {
    "run_id": "cas-e8d95042-1a28-43bd-ac29-b7ff67b60f0b",
    "approach": "llm_ocr_plus_math_core",
    "stage": "verify",
    "model": "sympy@1.14.0",
    "duration_ms": 0,
    "created_at": "2026-10-08T18:15:31.980025Z",
    "tool_versions": {
      "sympy": "1.14.0"
    }
  }
}
