{
  "schema_version": "1.0",
  "id": "img_194_pert_1.5",
  "steps": [
    {
      "step_id": "s1",
      "kind": "initial",
      "latex": "\\frac{1}{8!} + \\frac{1}{9 \\times 8!} = \\frac{x}{10 \\times 9 \\times 8!}",
      "derives_from": []
    },
    {
      "step_id": "s2",
      "kind": "step",
      "latex": "1 + \\frac{1}{9} = \\frac{x}{10 \\times 8} \\quad \\text{or} \\quad \\frac{10}{9} = \\frac{x}{10 \\times 8}",
      "derives_from": [
        "s1"
      ]
    },
    {
      "step_id": "s3",
      "kind": "answer",
      "latex": "x = 90.",
      "derives_from": [
        "s2"
      ]
    }
  ],
  "pipeline": {
    "approach": "llm_ocr_plus_math_core",
    "stages": [
      {
        "name": "transcribe",
        "backend": "ground-truth",
        "status": "ok"
      },
      {
        "name": "verify",
        "backend": "sympy@1.14.0",
        "status": "ok",
        "duration_ms": 1025
      }
    ]
  },
  "verdict": "incorrect",
  "is_correct": false,
  "first_error_step": "s1",
  "last_correct_step": null,
  "findings": [
    {
      "finding_id": "f1",
      "step_id": "s1",
      "error_code": "algebra",
      "severity": "error",
      "message": "Символьная проверка обнаружила неверное равенство или переход.",
      "explanation": "Exact expression identity with preserved domain",
      "confidence": 1.0,
      "detected_by": "math_core",
      "evidence": {
        "check": "Exact expression identity with preserved domain",
        "actual_latex": "\\frac{1}{8!} + \\frac{1}{9 \\times 8!} = \\frac{x}{10 \\times 9 \\times 8!}",
        "engine": "sympy"
      }
    },
    {
      "finding_id": "f2",
      "step_id": "s2",
      "error_code": "algebra",
      "severity": "error",
      "message": "Символьная проверка обнаружила неверное равенство или переход.",
      "explanation": "Disjunction needs a branch context; Exact expression identity with preserved domain; Separate equation/substitution requires task context",
      "confidence": 1.0,
      "detected_by": "math_core",
      "evidence": {
        "check": "Disjunction needs a branch context; Exact expression identity with preserved domain; Separate equation/substitution requires task context",
        "actual_latex": "1 + \\frac{1}{9} = \\frac{x}{10 \\times 8} \\quad \\text{or} \\quad \\frac{10}{9} = \\frac{x}{10 \\times 8}",
        "engine": "sympy"
      }
    }
  ],
  "steps_reviewed": [
    {
      "step_id": "s1",
      "verdict": "error",
      "finding_ids": [
        "f1"
      ]
    },
    {
      "step_id": "s2",
      "verdict": "error",
      "finding_ids": [
        "f2"
      ]
    },
    {
      "step_id": "s3",
      "verdict": "correct",
      "note": "Symbolic equation is a premise; checked against previous equation when applicable"
    }
  ],
  "meta": {
    "run_id": "cas-9c9a51a1-d3ef-4382-bc88-60c49840e888",
    "approach": "llm_ocr_plus_math_core",
    "stage": "verify",
    "model": "sympy@1.14.0",
    "duration_ms": 1025,
    "created_at": "2026-10-09T22:26:39.864941Z",
    "tool_versions": {
      "sympy": "1.14.0"
    }
  }
}
