{
  "schema_version": "1.0",
  "id": "img_466_pert_1.4",
  "steps": [
    {
      "step_id": "s1",
      "kind": "initial",
      "latex": "M_{11} = \\begin{vmatrix} 0 & 4 \\\\ 5 & -7 \\end{vmatrix} = (0)(-7) - (4)(5) = 0 - 20 = -20; \\quad A_{11} = (-1)^{1+1}(-20) = -20",
      "derives_from": []
    },
    {
      "step_id": "s2",
      "kind": "step",
      "latex": "M_{12} = \\begin{vmatrix} 6 & 4 \\\\ 1 & -7 \\end{vmatrix} = (6)(-7) - (4)(1) = -42 - 4 = -46; \\quad A_{12} = (-1)^{1+2}(-46) = 46",
      "derives_from": [
        "s1"
      ]
    },
    {
      "step_id": "s3",
      "kind": "step",
      "latex": "M_{13} = \\begin{vmatrix} 6 & 0 \\\\ 1 & 5 \\end{vmatrix} = (6)(5) - (0)(1) = 30 - 0 = 30; \\quad A_{13} = (-1)^{1+3}(30) = 30",
      "derives_from": [
        "s2"
      ]
    },
    {
      "step_id": "s4",
      "kind": "step",
      "latex": "M_{21} = \\begin{vmatrix} -3 & 5 \\\\ 5 & -7 \\end{vmatrix} = (-3)(-7) - (5)(0) = 21 - 0 = 21; \\quad A_{21} = (-1)^{2+1}(21) = -21",
      "derives_from": [
        "s3"
      ]
    },
    {
      "step_id": "s5",
      "kind": "step",
      "latex": "M_{22} = \\begin{vmatrix} 2 & 5 \\\\ 1 & -7 \\end{vmatrix} = (2)(-7) - (5)(1) = -14 - 5 = -19; \\quad A_{22} = (-1)^{2+2}(-19) = -19",
      "derives_from": [
        "s4"
      ]
    },
    {
      "step_id": "s6",
      "kind": "step",
      "latex": "M_{23} = \\begin{vmatrix} 2 & -3 \\\\ 1 & 5 \\end{vmatrix} = (2)(5) - (-3)(1) = 10 + 3 = 13; \\quad A_{23} = (-1)^{2+3}(13) = -13",
      "derives_from": [
        "s5"
      ]
    },
    {
      "step_id": "s7",
      "kind": "step",
      "latex": "M_{31} = \\begin{vmatrix} -3 & 5 \\\\ 0 & 4 \\end{vmatrix} = (-3)(4) - (5)(0) = -12 - 0 = -12; \\quad A_{31} = (-1)^{3+1}(-12) = -12",
      "derives_from": [
        "s6"
      ]
    },
    {
      "step_id": "s8",
      "kind": "step",
      "latex": "M_{32} = \\begin{vmatrix} 2 & 5 \\\\ 6 & 4 \\end{vmatrix} = (2)(4) - (5)(6) = 8 - 30 = -22; \\quad A_{32} = (-1)^{3+2}(-22) = 22",
      "derives_from": [
        "s7"
      ]
    },
    {
      "step_id": "s9",
      "kind": "step",
      "latex": "M_{33} = \\begin{vmatrix} 2 & -3 \\\\ 6 & 0 \\end{vmatrix} = (2)(0) - (-3)(6) = 0 + 18 = 18; \\quad A_{33} = (-1)^{3+3}(18) = 18",
      "derives_from": [
        "s8"
      ]
    },
    {
      "step_id": "s10",
      "kind": "answer",
      "latex": "a_{11} A_{31} + a_{12} A_{32} + a_{13} A_{33} = 2(-12) + (-3)(22) + 5(18) = -24 - 66 + 90 = 0.",
      "derives_from": [
        "s9"
      ]
    }
  ],
  "pipeline": {
    "approach": "llm_ocr_plus_math_core",
    "stages": [
      {
        "name": "transcribe",
        "backend": "ground-truth",
        "status": "ok"
      },
      {
        "name": "verify",
        "backend": "sympy@1.14.0",
        "status": "ok",
        "duration_ms": 892
      }
    ]
  },
  "verdict": "incorrect",
  "is_correct": false,
  "first_error_step": "s4",
  "last_correct_step": "s3",
  "findings": [
    {
      "finding_id": "f1",
      "step_id": "s4",
      "error_code": "algebra",
      "severity": "error",
      "message": "Символьная проверка обнаружила неверное равенство или переход.",
      "explanation": "Symbolic equation is a premise; checked against previous equation when applicable; Exact expression identity with preserved domain",
      "confidence": 1.0,
      "detected_by": "math_core",
      "evidence": {
        "check": "Symbolic equation is a premise; checked against previous equation when applicable; Exact expression identity with preserved domain",
        "actual_latex": "M_{21} = \\begin{vmatrix} -3 & 5 \\\\ 5 & -7 \\end{vmatrix} = (-3)(-7) - (5)(0) = 21 - 0 = 21; \\quad A_{21} = (-1)^{2+1}(21) = -21",
        "engine": "sympy"
      }
    }
  ],
  "steps_reviewed": [
    {
      "step_id": "s1",
      "verdict": "correct",
      "note": "Symbolic equation is a premise; checked against previous equation when applicable; Exact expression identity with preserved domain"
    },
    {
      "step_id": "s2",
      "verdict": "correct",
      "note": "Symbolic equation is a premise; checked against previous equation when applicable; Exact expression identity with preserved domain"
    },
    {
      "step_id": "s3",
      "verdict": "correct",
      "note": "Symbolic equation is a premise; checked against previous equation when applicable; Exact expression identity with preserved domain"
    },
    {
      "step_id": "s4",
      "verdict": "error",
      "finding_ids": [
        "f1"
      ]
    },
    {
      "step_id": "s5",
      "verdict": "correct",
      "note": "Symbolic equation is a premise; checked against previous equation when applicable; Exact expression identity with preserved domain"
    },
    {
      "step_id": "s6",
      "verdict": "correct",
      "note": "Symbolic equation is a premise; checked against previous equation when applicable; Exact expression identity with preserved domain"
    },
    {
      "step_id": "s7",
      "verdict": "correct",
      "note": "Symbolic equation is a premise; checked against previous equation when applicable; Exact expression identity with preserved domain"
    },
    {
      "step_id": "s8",
      "verdict": "correct",
      "note": "Symbolic equation is a premise; checked against previous equation when applicable; Exact expression identity with preserved domain"
    },
    {
      "step_id": "s9",
      "verdict": "correct",
      "note": "Symbolic equation is a premise; checked against previous equation when applicable; Exact expression identity with preserved domain"
    },
    {
      "step_id": "s10",
      "verdict": "indeterminate",
      "note": "Symbolic equation is a premise; checked against previous equation when applicable; Exact expression identity with preserved domain; Separate equation/substitution requires task context"
    }
  ],
  "meta": {
    "run_id": "cas-979221fa-28d9-4506-a320-e275fad2453d",
    "approach": "llm_ocr_plus_math_core",
    "stage": "verify",
    "model": "sympy@1.14.0",
    "duration_ms": 892,
    "created_at": "2026-10-09T22:28:28.112608Z",
    "tool_versions": {
      "sympy": "1.14.0"
    }
  }
}
