{
  "schema_version": "1.0",
  "id": "img_172_pert_3.2",
  "steps": [
    {
      "step_id": "s1",
      "kind": "initial",
      "latex": "-\\frac{2}{6} = \\frac{-1 \\times 2}{3 \\times 2}, \\quad -\\frac{3}{9} = \\frac{-1 \\times 3}{3 \\times 3}, \\quad -\\frac{4}{12} = \\frac{-1 \\times 4}{3 \\times 4}",
      "derives_from": []
    },
    {
      "step_id": "s2",
      "kind": "step",
      "latex": "\\frac{-1 \\times 1}{3 \\times 1} = \\frac{-1}{3}, \\quad \\frac{-1 \\times 2}{6}, \\quad \\frac{-2 + 1}{6}, \\quad \\frac{-3 + 1}{9}, \\quad \\frac{-1 \\times 4}{12} = \\frac{-4}{12}",
      "derives_from": [
        "s1"
      ]
    },
    {
      "step_id": "s3",
      "kind": "answer",
      "latex": "-\\frac{5}{15}, \\quad -\\frac{1 \\times 6}{3 \\times 6}, \\quad -\\frac{6 + 1}{18}, \\quad -\\frac{1 \\times 7}{3 \\times 7} = -\\frac{7}{21}.",
      "derives_from": [
        "s2"
      ]
    }
  ],
  "pipeline": {
    "approach": "llm_ocr_plus_math_core",
    "stages": [
      {
        "name": "transcribe",
        "backend": "ground-truth",
        "status": "ok"
      },
      {
        "name": "verify",
        "backend": "sympy@1.14.0",
        "status": "ok",
        "duration_ms": 0
      }
    ]
  },
  "verdict": "correct",
  "is_correct": true,
  "first_error_step": null,
  "last_correct_step": null,
  "findings": [],
  "steps_reviewed": [
    {
      "step_id": "s1",
      "verdict": "correct",
      "note": "Exact expression identity with preserved domain"
    },
    {
      "step_id": "s2",
      "verdict": "correct",
      "note": "Exact expression identity with preserved domain"
    },
    {
      "step_id": "s3",
      "verdict": "correct",
      "note": "Exact expression identity with preserved domain"
    }
  ],
  "meta": {
    "run_id": "cas-f80a1b19-2c39-4624-8ea9-c735860267d1",
    "approach": "llm_ocr_plus_math_core",
    "stage": "verify",
    "model": "sympy@1.14.0",
    "duration_ms": 0,
    "created_at": "2026-10-08T18:15:42.491090Z",
    "tool_versions": {
      "sympy": "1.14.0"
    }
  }
}
